{
  "schema_version": 2,
  "id": "SCN_CITY_CAPACITY",
  "revision": 1,
  "kind": "performance",
  "title": "Provisional city, crowd, and logistics capacity",
  "purpose": "Freeze a deliberately heavy native-Mac city workload for capacity profiling without presenting it as the final production population or settlement-size promise.",
  "applies_to_packets": [
    "WP-0002"
  ],
  "fixture": {
    "world_seed": "3003",
    "starting_tick": "36000",
    "tick_rate_hz": 10,
    "warmup_ticks": 3000,
    "duration_ticks": 12000,
    "warmup_seconds": 300,
    "duration_seconds": 1200,
    "starting_state_id": "provisional-city-capacity-v1",
    "content_set_id": "capacity-graybox-content-v1",
    "input_script_id": "city-capacity-camera-logistics-v1",
    "fixture_manifest": {
      "path": "scenarios/fixtures/SCN_CITY_CAPACITY/r1.fixture.json",
      "sha256": "93d7b1e064ee0e5a30e06b0ec260b4be60e52ed1190979303430cc63959438b5"
    }
  },
  "counts": {
    "state": {
      "authoritative_records": 4096,
      "save_sections": 9,
      "content_definitions": 64,
      "transactions": 4,
      "save_generations": 2
    },
    "entities": {
      "total": 370,
      "settlements": 1,
      "buildings": 128,
      "households": 200,
      "specialists": 20,
      "robots": 0,
      "vehicles": 12,
      "factions": 3,
      "crises": 2,
      "expeditions": 4
    },
    "objects": {
      "placed_total": 2048,
      "dynamic": 512,
      "static": 1536,
      "lod0": 256,
      "lod1": 768,
      "lod2": 1024
    },
    "lights": {
      "total": 129,
      "directional": 1,
      "point": 96,
      "spot": 32,
      "shadowed": 32
    },
    "crowd": {
      "authoritative_people": 1000,
      "visible_agents": 256,
      "offscreen_people": 744
    },
    "inputs": {
      "scripted_commands": 1200,
      "keyboard_events": 0,
      "controller_events": 0,
      "pointer_events": 300,
      "fault_injections": 0
    }
  },
  "parameters": [
    {
      "name": "backbuffer",
      "value": "2560x1600",
      "unit": "pixels"
    },
    {
      "name": "quality-preset",
      "value": "slice-quality",
      "unit": null
    },
    {
      "name": "queued-path-requests",
      "value": 512,
      "unit": "requests"
    },
    {
      "name": "logistics-routes",
      "value": 64,
      "unit": "routes"
    }
  ],
  "oracles": [
    {
      "id": "ORC_CITY_FRAME_P95",
      "subject": "whole-frame-p95",
      "operator": "less-or-equal",
      "expected": 16.7,
      "unit": "ms"
    },
    {
      "id": "ORC_CITY_FRAME_P99",
      "subject": "whole-frame-p99",
      "operator": "less-or-equal",
      "expected": 25.0,
      "unit": "ms"
    },
    {
      "id": "ORC_CITY_SIM_P95",
      "subject": "simulation-tick-p95",
      "operator": "less-or-equal",
      "expected": 4.0,
      "unit": "ms"
    },
    {
      "id": "ORC_CITY_PATH_AGE",
      "subject": "high-priority-path-age-p99",
      "operator": "less-or-equal",
      "expected": 500.0,
      "unit": "ms"
    },
    {
      "id": "ORC_CITY_INVARIANTS",
      "subject": "simulation-invariant-violations",
      "operator": "equal",
      "expected": 0,
      "unit": "count"
    }
  ]
}
