{
  "schema_version": 2,
  "id": "SCN_NEW_TOWN_30M",
  "revision": 1,
  "kind": "gameplay",
  "title": "New-town first loop in thirty minutes",
  "purpose": "Freeze the complete Last Bearing first-town path used to prove that a new player can read the water bottleneck, prepare home, travel, return, and persist consequences without hidden assistance.",
  "applies_to_packets": [
    "WP-0002"
  ],
  "fixture": {
    "world_seed": "3001",
    "starting_tick": "0",
    "tick_rate_hz": 10,
    "warmup_ticks": 0,
    "duration_ticks": 18000,
    "warmup_seconds": 0,
    "duration_seconds": 1800,
    "starting_state_id": "last-bearing-new-town-v1",
    "content_set_id": "last-bearing-graybox-content-v1",
    "input_script_id": "new-town-workshop-winch-cooperate-v1",
    "fixture_manifest": {
      "path": "scenarios/fixtures/SCN_NEW_TOWN_30M/r1.fixture.json",
      "sha256": "02e26ab176d0d4a73143fe6cb379338ef089aac2ad83773d97013122bbca8071"
    }
  },
  "counts": {
    "state": {
      "authoritative_records": 240,
      "save_sections": 9,
      "content_definitions": 32,
      "transactions": 1,
      "save_generations": 4
    },
    "entities": {
      "total": 23,
      "settlements": 1,
      "buildings": 10,
      "households": 6,
      "specialists": 1,
      "robots": 1,
      "vehicles": 1,
      "factions": 1,
      "crises": 1,
      "expeditions": 1
    },
    "objects": {
      "placed_total": 180,
      "dynamic": 60,
      "static": 120,
      "lod0": 60,
      "lod1": 80,
      "lod2": 40
    },
    "lights": {
      "total": 25,
      "directional": 1,
      "point": 16,
      "spot": 8,
      "shadowed": 12
    },
    "crowd": {
      "authoritative_people": 30,
      "visible_agents": 24,
      "offscreen_people": 6
    },
    "inputs": {
      "scripted_commands": 120,
      "keyboard_events": 1200,
      "controller_events": 0,
      "pointer_events": 300,
      "fault_injections": 0
    }
  },
  "parameters": [
    {
      "name": "preparation",
      "value": "workshop-push",
      "unit": null
    },
    {
      "name": "vehicle-module",
      "value": "winch-assembly",
      "unit": null
    },
    {
      "name": "depot-resolution",
      "value": "cooperate",
      "unit": null
    },
    {
      "name": "hidden-assistance",
      "value": false,
      "unit": null
    }
  ],
  "oracles": [
    {
      "id": "ORC_NEW_TOWN_COMPLETE",
      "subject": "first-loop-completed",
      "operator": "equal",
      "expected": true,
      "unit": null
    },
    {
      "id": "ORC_NEW_TOWN_ASSISTANCE",
      "subject": "hidden-assistance-events",
      "operator": "equal",
      "expected": 0,
      "unit": "count"
    },
    {
      "id": "ORC_NEW_TOWN_BOTTLENECK",
      "subject": "first-bottleneck-action-time",
      "operator": "less-or-equal",
      "expected": 300,
      "unit": "seconds"
    },
    {
      "id": "ORC_NEW_TOWN_PRODUCTION",
      "subject": "completed-production-chains",
      "operator": "greater-or-equal",
      "expected": 1,
      "unit": "count"
    },
    {
      "id": "ORC_NEW_TOWN_CHANGES",
      "subject": "persistent-cross-domain-changes",
      "operator": "greater-or-equal",
      "expected": 3,
      "unit": "count"
    },
    {
      "id": "ORC_NEW_TOWN_STATE",
      "subject": "canonical-state-mismatches-after-reload",
      "operator": "equal",
      "expected": 0,
      "unit": "count"
    }
  ]
}
