{
  "schema_version": 2,
  "id": "SCN_WP0003_LOCAL",
  "revision": 1,
  "kind": "aggregate",
  "title": "WP-0003 local-development gate aggregation",
  "purpose": "Aggregate the lean local-development packet checks without executing Unity or simulation.",
  "applies_to_packets": [
    "WP-0003"
  ],
  "fixture": {
    "world_seed": "1007",
    "starting_tick": "0",
    "tick_rate_hz": 1,
    "warmup_ticks": 0,
    "duration_ticks": 0,
    "warmup_seconds": 0,
    "duration_seconds": 0,
    "starting_state_id": "no-runtime-state-v1",
    "content_set_id": "no-runtime-content-v1",
    "input_script_id": "aggregate-wp0003-local-evidence-v1",
    "fixture_manifest": {
      "path": "scenarios/fixtures/SCN_WP0003_LOCAL/r1.fixture.json",
      "sha256": "3f4ccfdc1e93e5e150b4b4eebc164c7bd7f2359fba48ff77fbb6a8e6215ad813"
    }
  },
  "counts": {
    "state": {
      "authoritative_records": 0,
      "save_sections": 0,
      "content_definitions": 0,
      "transactions": 0,
      "save_generations": 0
    },
    "entities": {
      "total": 0,
      "settlements": 0,
      "buildings": 0,
      "households": 0,
      "specialists": 0,
      "robots": 0,
      "vehicles": 0,
      "factions": 0,
      "crises": 0,
      "expeditions": 0
    },
    "objects": {
      "placed_total": 0,
      "dynamic": 0,
      "static": 0,
      "lod0": 0,
      "lod1": 0,
      "lod2": 0
    },
    "lights": {
      "total": 0,
      "directional": 0,
      "point": 0,
      "spot": 0,
      "shadowed": 0
    },
    "crowd": {
      "authoritative_people": 0,
      "visible_agents": 0,
      "offscreen_people": 0
    },
    "inputs": {
      "scripted_commands": 0,
      "keyboard_events": 0,
      "controller_events": 0,
      "pointer_events": 0,
      "fault_injections": 0
    }
  },
  "parameters": [
    {
      "name": "required-acceptance-tests",
      "value": 9,
      "unit": "tests"
    },
    {
      "name": "minimum-runs",
      "value": 1,
      "unit": "runs"
    }
  ],
  "oracles": [
    {
      "id": "ORC_WP0003_TESTS",
      "subject": "required-test-failures",
      "operator": "equal",
      "expected": 0,
      "unit": "count"
    }
  ]
}
