{
  "schema_version": 2,
  "id": "SCN_BEARING_TAKE",
  "revision": 1,
  "kind": "gameplay",
  "title": "Last Bearing adverse take outcome",
  "purpose": "Freeze the Civic Buffer plus Sealed Range Tank path in which the faction has established its claim and the player takes the bearing without agreement.",
  "applies_to_packets": [
    "WP-0002"
  ],
  "fixture": {
    "world_seed": "2003",
    "starting_tick": "0",
    "tick_rate_hz": 10,
    "warmup_ticks": 0,
    "duration_ticks": 18000,
    "warmup_seconds": 0,
    "duration_seconds": 1800,
    "starting_state_id": "last-bearing-new-town-v1",
    "content_set_id": "last-bearing-graybox-content-v1",
    "input_script_id": "buffer-range-take-v1",
    "fixture_manifest": {
      "path": "scenarios/fixtures/SCN_BEARING_TAKE/r1.fixture.json",
      "sha256": "35d022dc33c07a7db0296791e91ad5e525b284b0474c09e2dca9f5a5dc56364f"
    }
  },
  "counts": {
    "state": {
      "authoritative_records": 240,
      "save_sections": 9,
      "content_definitions": 32,
      "transactions": 1,
      "save_generations": 4
    },
    "entities": {
      "total": 23,
      "settlements": 1,
      "buildings": 10,
      "households": 6,
      "specialists": 1,
      "robots": 1,
      "vehicles": 1,
      "factions": 1,
      "crises": 1,
      "expeditions": 1
    },
    "objects": {
      "placed_total": 0,
      "dynamic": 0,
      "static": 0,
      "lod0": 0,
      "lod1": 0,
      "lod2": 0
    },
    "lights": {
      "total": 0,
      "directional": 0,
      "point": 0,
      "spot": 0,
      "shadowed": 0
    },
    "crowd": {
      "authoritative_people": 30,
      "visible_agents": 0,
      "offscreen_people": 30
    },
    "inputs": {
      "scripted_commands": 126,
      "keyboard_events": 0,
      "controller_events": 0,
      "pointer_events": 0,
      "fault_injections": 0
    }
  },
  "parameters": [
    {
      "name": "preparation",
      "value": "civic-buffer",
      "unit": null
    },
    {
      "name": "vehicle-module",
      "value": "sealed-range-tank",
      "unit": null
    },
    {
      "name": "depot-resolution",
      "value": "take-without-agreement",
      "unit": null
    },
    {
      "name": "arrival-state",
      "value": "faction-claim-established",
      "unit": null
    }
  ],
  "oracles": [
    {
      "id": "ORC_TAKE_STATE",
      "subject": "canonical-state-mismatches-after-reload",
      "operator": "equal",
      "expected": 0,
      "unit": "count"
    },
    {
      "id": "ORC_TAKE_CHANGES",
      "subject": "persistent-cross-domain-changes",
      "operator": "greater-or-equal",
      "expected": 3,
      "unit": "count"
    },
    {
      "id": "ORC_TAKE_BEHAVIORS",
      "subject": "faction-behavior-changes",
      "operator": "greater-or-equal",
      "expected": 2,
      "unit": "count"
    },
    {
      "id": "ORC_TAKE_GRIEVANCE",
      "subject": "faction-grievance-events",
      "operator": "greater-or-equal",
      "expected": 1,
      "unit": "count"
    },
    {
      "id": "ORC_TAKE_DUPLICATION",
      "subject": "duplicate-or-lost-ownership",
      "operator": "equal",
      "expected": 0,
      "unit": "count"
    }
  ]
}
