{
  "schema_version": 2,
  "id": "SCN_TIME_POLICY",
  "revision": 1,
  "kind": "gameplay",
  "title": "Supported city-road clock policies",
  "purpose": "Run slowed, paused, and full city-time policies through departure, road play, explicit pause, auto-pause alert, encounter, and return; WP-0002 must use the case matching the creator-ratified D-0008 claim.",
  "applies_to_packets": [
    "WP-0002"
  ],
  "fixture": {
    "world_seed": "2014",
    "starting_tick": "0",
    "tick_rate_hz": 10,
    "warmup_ticks": 0,
    "duration_ticks": 18000,
    "warmup_seconds": 0,
    "duration_seconds": 1800,
    "starting_state_id": "last-bearing-time-policy-state-v1",
    "content_set_id": "last-bearing-graybox-content-v1",
    "input_script_id": "time-policy-three-cases-v1",
    "fixture_manifest": {
      "path": "scenarios/fixtures/SCN_TIME_POLICY/r1.fixture.json",
      "sha256": "498222940aca74c92b10a74aef6fa9f76e80a7480637821f837feef7e366d51f"
    }
  },
  "counts": {
    "state": {
      "authoritative_records": 90,
      "save_sections": 8,
      "content_definitions": 12,
      "transactions": 3,
      "save_generations": 6
    },
    "entities": {
      "total": 12,
      "settlements": 1,
      "buildings": 4,
      "households": 1,
      "specialists": 1,
      "robots": 1,
      "vehicles": 1,
      "factions": 1,
      "crises": 1,
      "expeditions": 1
    },
    "objects": {
      "placed_total": 0,
      "dynamic": 0,
      "static": 0,
      "lod0": 0,
      "lod1": 0,
      "lod2": 0
    },
    "lights": {
      "total": 0,
      "directional": 0,
      "point": 0,
      "spot": 0,
      "shadowed": 0
    },
    "crowd": {
      "authoritative_people": 4,
      "visible_agents": 2,
      "offscreen_people": 2
    },
    "inputs": {
      "scripted_commands": 180,
      "keyboard_events": 0,
      "controller_events": 0,
      "pointer_events": 0,
      "fault_injections": 0
    }
  },
  "parameters": [
    {
      "name": "supported-policies",
      "value": "slowed,paused,full",
      "unit": null
    },
    {
      "name": "packet-selected-policy-source",
      "value": "D-0008-ratified-receipt",
      "unit": null
    }
  ],
  "oracles": [
    {
      "id": "ORC_TIME_CASES",
      "subject": "time-policy-cases-completed",
      "operator": "equal",
      "expected": 3,
      "unit": "cases"
    },
    {
      "id": "ORC_TIME_SELECTED",
      "subject": "packet-selected-policy-receipt-mismatches",
      "operator": "equal",
      "expected": 0,
      "unit": "count"
    },
    {
      "id": "ORC_TIME_FORECAST",
      "subject": "forecast-behavior-mismatches",
      "operator": "equal",
      "expected": 0,
      "unit": "count"
    }
  ],
  "cases": [
    {
      "id": "slowed",
      "counts": {
        "state": {
          "authoritative_records": 88,
          "save_sections": 8,
          "content_definitions": 12,
          "transactions": 1,
          "save_generations": 2
        },
        "entities": {
          "total": 12,
          "settlements": 1,
          "buildings": 4,
          "households": 1,
          "specialists": 1,
          "robots": 1,
          "vehicles": 1,
          "factions": 1,
          "crises": 1,
          "expeditions": 1
        },
        "objects": {
          "placed_total": 0,
          "dynamic": 0,
          "static": 0,
          "lod0": 0,
          "lod1": 0,
          "lod2": 0
        },
        "lights": {
          "total": 0,
          "directional": 0,
          "point": 0,
          "spot": 0,
          "shadowed": 0
        },
        "crowd": {
          "authoritative_people": 4,
          "visible_agents": 2,
          "offscreen_people": 2
        },
        "inputs": {
          "scripted_commands": 60,
          "keyboard_events": 0,
          "controller_events": 0,
          "pointer_events": 0,
          "fault_injections": 0
        }
      },
      "parameters": [
        {
          "name": "clock-policy",
          "value": "slowed",
          "unit": null
        }
      ],
      "oracles": [
        {
          "id": "ORC_TIME_SLOWED_SETTLEMENT",
          "subject": "slowed.settlement-clock-mismatches",
          "operator": "equal",
          "expected": 0,
          "unit": "count"
        },
        {
          "id": "ORC_TIME_SLOWED_FACTION",
          "subject": "slowed.faction-clock-mismatches",
          "operator": "equal",
          "expected": 0,
          "unit": "count"
        },
        {
          "id": "ORC_TIME_SLOWED_CRISIS",
          "subject": "slowed.crisis-weather-clock-mismatches",
          "operator": "equal",
          "expected": 0,
          "unit": "count"
        },
        {
          "id": "ORC_TIME_SLOWED_ROAD",
          "subject": "slowed.road-clock-mismatches",
          "operator": "equal",
          "expected": 0,
          "unit": "count"
        }
      ]
    },
    {
      "id": "paused",
      "counts": {
        "state": {
          "authoritative_records": 88,
          "save_sections": 8,
          "content_definitions": 12,
          "transactions": 1,
          "save_generations": 2
        },
        "entities": {
          "total": 12,
          "settlements": 1,
          "buildings": 4,
          "households": 1,
          "specialists": 1,
          "robots": 1,
          "vehicles": 1,
          "factions": 1,
          "crises": 1,
          "expeditions": 1
        },
        "objects": {
          "placed_total": 0,
          "dynamic": 0,
          "static": 0,
          "lod0": 0,
          "lod1": 0,
          "lod2": 0
        },
        "lights": {
          "total": 0,
          "directional": 0,
          "point": 0,
          "spot": 0,
          "shadowed": 0
        },
        "crowd": {
          "authoritative_people": 4,
          "visible_agents": 2,
          "offscreen_people": 2
        },
        "inputs": {
          "scripted_commands": 60,
          "keyboard_events": 0,
          "controller_events": 0,
          "pointer_events": 0,
          "fault_injections": 0
        }
      },
      "parameters": [
        {
          "name": "clock-policy",
          "value": "paused",
          "unit": null
        }
      ],
      "oracles": [
        {
          "id": "ORC_TIME_PAUSED_SETTLEMENT",
          "subject": "paused.settlement-clock-mismatches",
          "operator": "equal",
          "expected": 0,
          "unit": "count"
        },
        {
          "id": "ORC_TIME_PAUSED_FACTION",
          "subject": "paused.faction-clock-mismatches",
          "operator": "equal",
          "expected": 0,
          "unit": "count"
        },
        {
          "id": "ORC_TIME_PAUSED_CRISIS",
          "subject": "paused.crisis-weather-clock-mismatches",
          "operator": "equal",
          "expected": 0,
          "unit": "count"
        },
        {
          "id": "ORC_TIME_PAUSED_ROAD",
          "subject": "paused.road-clock-mismatches",
          "operator": "equal",
          "expected": 0,
          "unit": "count"
        }
      ]
    },
    {
      "id": "full",
      "counts": {
        "state": {
          "authoritative_records": 88,
          "save_sections": 8,
          "content_definitions": 12,
          "transactions": 1,
          "save_generations": 2
        },
        "entities": {
          "total": 12,
          "settlements": 1,
          "buildings": 4,
          "households": 1,
          "specialists": 1,
          "robots": 1,
          "vehicles": 1,
          "factions": 1,
          "crises": 1,
          "expeditions": 1
        },
        "objects": {
          "placed_total": 0,
          "dynamic": 0,
          "static": 0,
          "lod0": 0,
          "lod1": 0,
          "lod2": 0
        },
        "lights": {
          "total": 0,
          "directional": 0,
          "point": 0,
          "spot": 0,
          "shadowed": 0
        },
        "crowd": {
          "authoritative_people": 4,
          "visible_agents": 2,
          "offscreen_people": 2
        },
        "inputs": {
          "scripted_commands": 60,
          "keyboard_events": 0,
          "controller_events": 0,
          "pointer_events": 0,
          "fault_injections": 0
        }
      },
      "parameters": [
        {
          "name": "clock-policy",
          "value": "full",
          "unit": null
        }
      ],
      "oracles": [
        {
          "id": "ORC_TIME_FULL_SETTLEMENT",
          "subject": "full.settlement-clock-mismatches",
          "operator": "equal",
          "expected": 0,
          "unit": "count"
        },
        {
          "id": "ORC_TIME_FULL_FACTION",
          "subject": "full.faction-clock-mismatches",
          "operator": "equal",
          "expected": 0,
          "unit": "count"
        },
        {
          "id": "ORC_TIME_FULL_CRISIS",
          "subject": "full.crisis-weather-clock-mismatches",
          "operator": "equal",
          "expected": 0,
          "unit": "count"
        },
        {
          "id": "ORC_TIME_FULL_ROAD",
          "subject": "full.road-clock-mismatches",
          "operator": "equal",
          "expected": 0,
          "unit": "count"
        }
      ]
    }
  ]
}
