{
  "schema_version": 2,
  "id": "SCN_BEARING_COOPERATE",
  "revision": 1,
  "kind": "gameplay",
  "title": "Last Bearing cooperative outcome",
  "purpose": "Freeze the Workshop Push plus Winch Assembly path in which the player cooperates at the depot and returns with a faction obligation and doctrine-shaped maintenance option.",
  "applies_to_packets": [
    "WP-0002"
  ],
  "fixture": {
    "world_seed": "2002",
    "starting_tick": "0",
    "tick_rate_hz": 10,
    "warmup_ticks": 0,
    "duration_ticks": 18000,
    "warmup_seconds": 0,
    "duration_seconds": 1800,
    "starting_state_id": "last-bearing-new-town-v1",
    "content_set_id": "last-bearing-graybox-content-v1",
    "input_script_id": "workshop-winch-cooperate-v1",
    "fixture_manifest": {
      "path": "scenarios/fixtures/SCN_BEARING_COOPERATE/r1.fixture.json",
      "sha256": "ff3da18bc53b9fc45a4c15b2d539a4fd90d9e4f232028a80fe082f5250524500"
    }
  },
  "counts": {
    "state": {
      "authoritative_records": 240,
      "save_sections": 9,
      "content_definitions": 32,
      "transactions": 1,
      "save_generations": 4
    },
    "entities": {
      "total": 23,
      "settlements": 1,
      "buildings": 10,
      "households": 6,
      "specialists": 1,
      "robots": 1,
      "vehicles": 1,
      "factions": 1,
      "crises": 1,
      "expeditions": 1
    },
    "objects": {
      "placed_total": 0,
      "dynamic": 0,
      "static": 0,
      "lod0": 0,
      "lod1": 0,
      "lod2": 0
    },
    "lights": {
      "total": 0,
      "directional": 0,
      "point": 0,
      "spot": 0,
      "shadowed": 0
    },
    "crowd": {
      "authoritative_people": 30,
      "visible_agents": 0,
      "offscreen_people": 30
    },
    "inputs": {
      "scripted_commands": 120,
      "keyboard_events": 0,
      "controller_events": 0,
      "pointer_events": 0,
      "fault_injections": 0
    }
  },
  "parameters": [
    {
      "name": "preparation",
      "value": "workshop-push",
      "unit": null
    },
    {
      "name": "vehicle-module",
      "value": "winch-assembly",
      "unit": null
    },
    {
      "name": "depot-resolution",
      "value": "cooperate",
      "unit": null
    },
    {
      "name": "arrival-state",
      "value": "before-faction-claim",
      "unit": null
    }
  ],
  "oracles": [
    {
      "id": "ORC_COOPERATE_STATE",
      "subject": "canonical-state-mismatches-after-reload",
      "operator": "equal",
      "expected": 0,
      "unit": "count"
    },
    {
      "id": "ORC_COOPERATE_CHANGES",
      "subject": "persistent-cross-domain-changes",
      "operator": "greater-or-equal",
      "expected": 3,
      "unit": "count"
    },
    {
      "id": "ORC_COOPERATE_BEHAVIORS",
      "subject": "faction-behavior-changes",
      "operator": "greater-or-equal",
      "expected": 2,
      "unit": "count"
    },
    {
      "id": "ORC_COOPERATE_DOCTRINE",
      "subject": "doctrine-shaped-city-changes",
      "operator": "greater-or-equal",
      "expected": 1,
      "unit": "count"
    },
    {
      "id": "ORC_COOPERATE_DUPLICATION",
      "subject": "duplicate-or-lost-ownership",
      "operator": "equal",
      "expected": 0,
      "unit": "count"
    }
  ]
}
