{
  "schema_version": 2,
  "id": "SCN_UGLY_TOY",
  "revision": 1,
  "kind": "performance",
  "title": "Ugly constitutional toy native Mac workload",
  "purpose": "Freeze one keyboard-driven city-road-faction loop for native Mac frame-time and simulation profiling while the four gameplay permutations remain separate correctness evidence.",
  "applies_to_packets": [
    "WP-0002"
  ],
  "fixture": {
    "world_seed": "2001",
    "starting_tick": "0",
    "tick_rate_hz": 10,
    "warmup_ticks": 3000,
    "duration_ticks": 12000,
    "warmup_seconds": 300,
    "duration_seconds": 1200,
    "starting_state_id": "last-bearing-ugly-toy-v1",
    "content_set_id": "last-bearing-graybox-content-v1",
    "input_script_id": "workshop-winch-keyboard-path-v1",
    "fixture_manifest": {
      "path": "scenarios/fixtures/SCN_UGLY_TOY/r1.fixture.json",
      "sha256": "681b04b93519cbc3c71366613a81ee7155083baa7a8e635de22bf4d56241647f"
    }
  },
  "counts": {
    "state": {
      "authoritative_records": 240,
      "save_sections": 9,
      "content_definitions": 32,
      "transactions": 1,
      "save_generations": 4
    },
    "entities": {
      "total": 23,
      "settlements": 1,
      "buildings": 10,
      "households": 6,
      "specialists": 1,
      "robots": 1,
      "vehicles": 1,
      "factions": 1,
      "crises": 1,
      "expeditions": 1
    },
    "objects": {
      "placed_total": 180,
      "dynamic": 60,
      "static": 120,
      "lod0": 60,
      "lod1": 80,
      "lod2": 40
    },
    "lights": {
      "total": 25,
      "directional": 1,
      "point": 16,
      "spot": 8,
      "shadowed": 12
    },
    "crowd": {
      "authoritative_people": 30,
      "visible_agents": 24,
      "offscreen_people": 6
    },
    "inputs": {
      "scripted_commands": 600,
      "keyboard_events": 1200,
      "controller_events": 0,
      "pointer_events": 300,
      "fault_injections": 0
    }
  },
  "parameters": [
    {
      "name": "backbuffer",
      "value": "2560x1600",
      "unit": "pixels"
    },
    {
      "name": "quality-preset",
      "value": "slice-quality",
      "unit": null
    },
    {
      "name": "preparation",
      "value": "workshop-push",
      "unit": null
    },
    {
      "name": "vehicle-module",
      "value": "winch-assembly",
      "unit": null
    },
    {
      "name": "road-input",
      "value": "keyboard",
      "unit": null
    }
  ],
  "oracles": [
    {
      "id": "ORC_TOY_FRAME_P95",
      "subject": "whole-frame-p95",
      "operator": "less-or-equal",
      "expected": 16.7,
      "unit": "ms"
    },
    {
      "id": "ORC_TOY_FRAME_P99",
      "subject": "whole-frame-p99",
      "operator": "less-or-equal",
      "expected": 25.0,
      "unit": "ms"
    },
    {
      "id": "ORC_TOY_SIM_P95",
      "subject": "simulation-tick-p95",
      "operator": "less-or-equal",
      "expected": 4.0,
      "unit": "ms"
    },
    {
      "id": "ORC_TOY_OWNERSHIP",
      "subject": "ownership-invariant-violations",
      "operator": "equal",
      "expected": 0,
      "unit": "count"
    },
    {
      "id": "ORC_TOY_PATH_QUEUE",
      "subject": "high-priority-path-age-p99",
      "operator": "less-or-equal",
      "expected": 500.0,
      "unit": "ms"
    }
  ]
}
